name,ingredients,health-info,diet,image
Judy Hesser&#39;s Old School Hamburger Soup,"['1 pound ground beef', '1 tablespoon flour', '1 cup onion, chopped', '1 cup carrot, rough diced', '1 cup celery, rough diced', '1 teaspoon kosher salt', '1/2 teaspoon freshly cracked black pepper', '1 tablespoon tomato paste', '14.5 ounces can diced tomatoes in juices', '1 cup cabbage, chopped', '1-2 tablespoons Worchestershire sauce', '3 cups beef stock (or 3 c water with a beef bouillon cube)', '1-2 tablespoons oil (olive, canola, whatever you have)', '1 handful small pasta such as ditalini, optional']","['Peanut-Free', 'Tree-Nut-Free', 'Alcohol-Free', 'Immuno-Supportive']",['Low-Carb'],https://www.edamam.com/web-img/a32/a32d1b8fb92ecbe28649f2406abba64e.jpeg
Gluten Free Ritornelli Cookies,"['35 grams Cocoa Powder', '35 grams Coconut Milk', '35 grams Agave Syrup', '10 grams Coconut Oil (melted)', '10 grams 99% Dark Chocolate (melted)', ""60 grams Rice Fluor (OR Cassava Flour if you can\\\\'t tolerate grains)"", ""100 grams Rice Fluor (OR Cassava Flour if you can\\\\'t tolerate grains)"", ""30 grams Almond Flour (OR Tigernut Flour if you can\\\\'t tolerate nuts)"", '40 grams Coconut Milk', '10 grams Coconut Oil (melted)', '35 grams Agave Syrup', '1/8 teaspoon Vanilla Extract']","['Vegetarian', 'Alcohol-Free']",[],https://www.edamam.com/web-img/25a/25a28f51ee6fbee9d725ea2fe4171e5e.jpg
"Miso Soup Is the Cheapest, Easiest Vegan Breakfast","['1-2 tablespoons miso, depending on taste', 'About 1½ cups water', 'About ½ cup soft tofu, cubed (but really, use as much or as little as you want)', ""Sliced vegetables, like carrots or potatoes or snowpeas or mushrooms, whatever you've got in the fridge (optional)"", 'Wakame (optional)', 'Scallions, thinly sliced (optional)']","['Vegan', 'Vegetarian', 'Peanut-Free', 'Tree-Nut-Free', 'Alcohol-Free']",[],https://www.edamam.com/web-img/717/71794afb6c4bd334129b402f51352d8c.jpg
Balanced Green Juice Recipe,"['1/2 cup (4 ounces) fresh cucumber juice from about 1 medium cucumber', '3 tablespoons (1 1/2 ounces) fresh kale juice from about 4 medium leaves kale', '1 tablespoon plus 1 teaspoon (2/3 ounce) fresh cilantro juice from about 1 packed cup cilantro leaves and stems', '1/2 cup (4 ounces) fresh apple juice from about 1 large apple, cored and quartered', '1 tablespoon (1/2 ounce) fresh ginger juice from a about 1 1/2-inch piece ginger', '1 tablespoon plus 2 teaspoons (5/6 ounce) fresh lime juice from 1 to 2 limes, peeled', '1/2 cup (4 ounces) fresh celery juice from about 3 medium celery stalks']","['Vegan', 'Vegetarian', 'Peanut-Free', 'Tree-Nut-Free', 'Alcohol-Free', 'Immuno-Supportive']",['Low-Fat'],https://www.edamam.com/web-img/a1c/a1c927f1c9efe8d432fa0da89d5e3bfc.jpg
Homemade Nilla Wafers (Leave the Box on the Shelf) Recipe,"['8 tablespoons unsalted butter, softened (1 stick or 112g)', '1/4teaspoon salt', '1 cup sugar (210g)', '1 vanilla bean, seeds only', '1 large egg white (~33g)', '1 ½ teaspoons vanilla extract', '1 tablespoon milk', '1 1/3 cups AP flour (160g)', '3/4 teaspoon baking powder (~3g)']","['Vegetarian', 'Peanut-Free', 'Tree-Nut-Free', 'Alcohol-Free']",[],https://www.edamam.com/web-img/e1e/e1e3655ea86ff530e330032fa3583104.jpg
Make This 5-Ingredient Vegan Cashew Yogurt for Breakfast and Calm Down,"['1 ½ cups raw, unsalted cashew nuts', '1 lemon, juiced', '⅓ cup canned coconut milk', '1 tablespoon vanilla extract', 'Raspberries, for serving']","['Sugar-Conscious', 'Vegan', 'Vegetarian', 'Peanut-Free', 'Alcohol-Free']",['Low-Carb'],https://www.edamam.com/web-img/e57/e579e4a4e00a2d8c2faac5ffc6860f40.jpg
This Vegan Breakfast Cake Tastes Like a Bowl of Cornflakes,"['1 ¼ cup all-purpose flour', '1 cup sugar', '½ cup soy milk', '⅓ cup coconut milk', '½ cup banana, blended', '½ cup vegan butter, melted', '1 ¼ teaspoon baking powder', '¼ teaspoon baking soda', '1 teaspoon banana extract', '1 tablespoon vanilla extract', '½ chocolate chips', '¾ cup walnuts, chopped']","['Vegetarian', 'Peanut-Free', 'Alcohol-Free']",[],https://www.edamam.com/web-img/aa0/aa06177cbddb7ad3cedf348f1d6d4d86.jpg
The Crisper Whisperer: A Seriously Delicious 'Green' Smoothie Recipe,"['1 medium orange, peeled and seeded', '1 medium banana', '2 cups raspberries (frozen are great)', '3 ounces baby spinach (about 2 cups packed)', '5 dried dates, pitted', '2 tablespoons ground flaxseeds (optional)', '1 cup ice, if not using frozen berries']","['Vegan', 'Vegetarian', 'Peanut-Free', 'Tree-Nut-Free', 'Alcohol-Free', 'Immuno-Supportive']",['Low-Fat'],https://www.edamam.com/web-img/951/9519ab38a00a16c7afd0e3983d634ad7.jpg
How To Make the Best Chocolate Avocado Pudding,"['4 very ripe Hass avocados (about 2 pounds total)', '1/4 cup plain, chocolate preferred, or vanilla non-dairy milk, at room temperature (', '3 to 5 tablespoons unsweetened cocoa powder', '2 teaspoons vanilla extract or vanilla bean paste', '1/4 teaspoon fine salt', '2 to 3 ounces of dark or bittersweet chocolate (70% or higher)']","['Vegan', 'Vegetarian', 'Peanut-Free', 'Tree-Nut-Free', 'Alcohol-Free']",['Low-Carb'],https://www.edamam.com/web-img/8c4/8c49e867afda49034d91a35f63b45495
